<?xml version="1.0"?>
<!DOCTYPE Group-Store PUBLIC "-//uPortal//PAGSGroupStore/EN" "PAGSGroupStore.dtd">

<!--
    PAGSGroupStoreConfig.xml is used to configure the person attributes group store.
    See PAGSGroupStore.dtd for xml grammar.

    To control the attributes that are available, see ../personDirectory.xml.

    Author: Dan Ellentuck, de3@columbia.edu
    Version $Revision$

    This sample configuration sets up 4 groups in the following relationship:

    All (0)
     |- Users (1)
     |- Short First Names (2)
         |- Ds and Staff (3)

    that is, Users (1) and Short First Names (2) are members of All (0), and Ds and Staff
    is a member of Short First Names (2).  These declarations can be used to assess group
    membership for the 6 users delivered in the base code (demo, student, etc.)

-->


<Group-Store>

<!-- Group declarations: -->

<!--
  Group 0: "PAGS Root"
-->
  <group>
    <group-key>0</group-key>
    <group-name>PAGS Root</group-name>
    <group-description>Root group for all PAGS groups.  Convenience for adding PAGS groups to a local group.</group-description>
    <members>
      <member-key>1</member-key>
    </members>
  </group>


<!--
  Group 1: "All Users (PAGS)"
  All IPersons are memebers of this group
-->
  <group>
    <group-key>1</group-key>
    <group-name>All Users (PAGS)</group-name>
    <group-description>All Portal Users</group-description>
    <selection-test>
      <test-group>
        <test>
          <tester-class>org.jasig.portal.groups.pags.testers.AlwaysTrueTester</tester-class>
        </test>
      </test-group>
    </selection-test>
  </group>
  
  
  <!--==================== Other Examples ====================-->


<!--
  Group 2: "Short First Names"
  givenName has 5 or fewer characters
-->
<!-- 
  <group>
    <group-key>2</group-key>
    <group-name>Short First Names</group-name>
    <group-description>Portal users whose first names are between 1 and 5 characters long</group-description>
    <selection-test>
      <test-group>
        <test>
          <attribute-name>givenName</attribute-name>
          <tester-class>org.jasig.portal.groups.pags.testers.RegexTester</tester-class>
          <test-value>^.{1,5}$</test-value>
        </test>
      </test-group>
    </selection-test>
    <members>
      <member-key>3</member-key>
    </members>
  </group>
 -->

<!--
  Group 3: "Ds and Students"
  givenName starts with D or equals "Student" since the results of the test-group elements are
  OR-ed together.  HOWEVER, since this group is a member of group 2, members of this group must
  also qualify as members of group 2, i.e., given name must have 5 or fewer characters.  As a
  result, Student User should not show up as a member.
-->
<!-- 
  <group>
    <group-key>3</group-key>
    <group-name>Ds and Students</group-name>
    <group-description>Portal users whose first names begin with D or equal Student</group-description>
    <selection-test>
      <test-group>
        <test>
          <attribute-name>givenName</attribute-name>
          <tester-class>org.jasig.portal.groups.pags.testers.RegexTester</tester-class>
          <test-value>^D.*$</test-value>
        </test>
      </test-group>
      <test-group>
        <test>
          <attribute-name>givenName</attribute-name>
          <tester-class>org.jasig.portal.groups.pags.testers.StringEqualsTester</tester-class>
          <test-value>Student</test-value>
        </test>
      </test-group>
    </selection-test>
  </group>
 -->


<!-- End Group declarations: -->

</Group-Store>
