<?xml version="1.0"?>
<!--

    Licensed to Jasig under one or more contributor license
    agreements. See the NOTICE file distributed with this work
    for additional information regarding copyright ownership.
    Jasig licenses this file to you under the Apache License,
    Version 2.0 (the "License"); you may not use this file
    except in compliance with the License. You may obtain a
    copy of the License at:

    http://www.apache.org/licenses/LICENSE-2.0

    Unless required by applicable law or agreed to in writing,
    software distributed under the License is distributed on
    an "AS IS" BASIS, WITHOUT WARRANTIES OR CONDITIONS OF ANY
    KIND, either express or implied. See the License for the
    specific language governing permissions and limitations
    under the License.

-->

<!DOCTYPE Group-Store PUBLIC "-//uPortal//PAGSGroupStore/EN" "PAGSGroupStore.dtd">

<!--
    PAGSGroupStoreConfig.xml is used to configure the person attributes group store.
    See PAGSGroupStore.dtd for xml grammar.

    To control the attributes that are available, see ../personDirectory.xml.

    Author: Dan Ellentuck, de3@columbia.edu
    Version $Revision$

    This sample configuration sets up 4 groups in the following relationship:

    All (0)
     |- Users (1)
     |- Short First Names (2)
         |- Ds and Staff (3)

    that is, Users (1) and Short First Names (2) are members of All (0), and Ds and Staff
    is a member of Short First Names (2).  These declarations can be used to assess group
    membership for the 6 users delivered in the base code (demo, student, etc.)

-->


<Group-Store>

<!-- Group declarations: -->

<!--
  Group pags_root: "PAGS Root"
  IMPORTANT: The PAGS Root group is REQUIRED for uPortal to function. It Must be a member of the Everyone group in the
  local group store
-->
  <group>
    <group-key>pags_root</group-key>
    <group-name>PAGS Root</group-name>
    <group-description>Root group for all PAGS groups.  Convenience for adding PAGS groups to a local group.</group-description>
    <members>
      <member-key>all_users</member-key>
    </members>
  </group>


<!--
  Group all_users: "All Users (PAGS)"
  All IPersons are memebers of this group
  IMPORTANT: The All Users group is REQUIRED for uPortal to function. It Must be a member of the PAGS Root group
-->
  <group>
    <group-key>all_users</group-key>
    <group-name>All Users (PAGS)</group-name>
    <group-description>All Portal Users</group-description>
    <selection-test>
      <test-group>
        <test>
          <attribute-name></attribute-name>
          <tester-class>org.jasig.portal.groups.pags.testers.AlwaysTrueTester</tester-class>
          <test-value></test-value>
        </test>
      </test-group>
    </selection-test>
  </group>
  
  <group>
    <group-key>authenticated_users</group-key>
    <group-name>Authenticated Users</group-name>
    <group-description>All Authenticated Portal Users</group-description>
    <selection-test>
      <test-group>
        <test>
          <attribute-name></attribute-name>
          <tester-class>org.jasig.portal.groups.pags.testers.GuestUserTester</tester-class>
          <test-value>false</test-value>
        </test>
      </test-group>
    </selection-test>
  </group>
  
  <!--==================== Other Examples ====================-->


<!--
  Group 2: "Short First Names"
  givenName has 5 or fewer characters
-->
<!-- 
  <group>
    <group-key>2</group-key>
    <group-name>Short First Names</group-name>
    <group-description>Portal users whose first names are between 1 and 5 characters long</group-description>
    <selection-test>
      <test-group>
        <test>
          <attribute-name>givenName</attribute-name>
          <tester-class>org.jasig.portal.groups.pags.testers.RegexTester</tester-class>
          <test-value>^.{1,5}$</test-value>
        </test>
      </test-group>
    </selection-test>
    <members>
      <member-key>3</member-key>
    </members>
  </group>
 -->

<!--
  Group 3: "Ds and Students"
  givenName starts with D or equals "Student" since the results of the test-group elements are
  OR-ed together.  HOWEVER, since this group is a member of group 2, members of this group must
  also qualify as members of group 2, i.e., given name must have 5 or fewer characters.  As a
  result, Student User should not show up as a member.
-->
<!-- 
  <group>
    <group-key>3</group-key>
    <group-name>Ds and Students</group-name>
    <group-description>Portal users whose first names begin with D or equal Student</group-description>
    <selection-test>
      <test-group>
        <test>
          <attribute-name>givenName</attribute-name>
          <tester-class>org.jasig.portal.groups.pags.testers.RegexTester</tester-class>
          <test-value>^D.*$</test-value>
        </test>
      </test-group>
      <test-group>
        <test>
          <attribute-name>givenName</attribute-name>
          <tester-class>org.jasig.portal.groups.pags.testers.StringEqualsTester</tester-class>
          <test-value>Student</test-value>
        </test>
      </test-group>
    </selection-test>
  </group>
 -->


<!-- End Group declarations: -->

</Group-Store>
